{
  "schema_version": "skill-spec.v1",
  "name": "B01 均匀介质 Helmholtz 技能草稿",
  "description": "来自 B01 128×128 均匀介质参考配置的格式示例。仅演示提交结构，代码主动终止；未执行仿真、未比较参考数据、未接纳。",
  "scenario_type": "point_source_2d",
  "parameters": {
    "dimensions": 2,
    "solver_mode": "frequency_domain",
    "medium_type": "homogeneous_water",
    "sound_speed_m_s": 1500,
    "density_kg_m3": 1000,
    "grid_shape": [
      128,
      128
    ],
    "dx_m": [
      0.001,
      0.001
    ],
    "frequency_hz": 238732.414637843,
    "pml_size": 16,
    "source_index": [
      32,
      32
    ],
    "source_type": "continuous_sinusoid",
    "source_geometry": "point",
    "helmholtz_source_coefficient": 1,
    "background_attenuation_db_mhz2_cm": 0,
    "material_regions": [],
    "boundary_condition": "absorbing_pml"
  },
  "code_template": "# Draft format example only. No result or reference answer is embedded.\nraise RuntimeError('draft_template_not_implemented')\n",
  "validation_request": {
    "policy": "server_required",
    "reference_case_id": "B01"
  },
  "author_notes": "B01未验证格式草稿，代码主动终止，不是可复用模板。omega=1.5e6 rad/s，源系数1不是1 Pa，不额外乘omega；显式无损。结果保留数值源归一化，不擅称绝对Pa。源、材料与结果字段由 SkillSpec normalizer_v2 完整保存，旧检索参数不自动升级。",
  "result_spec": {
    "kind": "steady_complex_pressure",
    "units": "numerical_source_normalization",
    "axis_order": [
      "x",
      "y"
    ],
    "grid_shape": [
      128,
      128
    ],
    "full_complex": true,
    "downsample": 1
  }
}
